"Rank","NCT Number","Title","Acronym","Status","Study Results","Conditions","Interventions","Outcome Measures","Sponsor/Collaborators","Gender","Age","Phases","Enrollment","Funded Bys","Study Type","Study Designs","Other IDs","Start Date","Primary Completion Date","Completion Date","First Posted","Results First Posted","Last Update Posted","Locations","Study Documents","URL"
357,"NCT03150862","A Study Assessing BGB-290 With Radiation and/or Temozolomide (TMZ) in Subjects With Newly Diagnosed or Recurrent Glioblastoma",,"Recruiting","No Results Available","Brain and Central Nervous System Tumors","Drug: BGB-290|Drug: TMZ|Radiation: Radiation","Incidence and nature of dose limiting toxicities (DLTs) as assessed by CTCAE|Incidence, nature and severity of adverse events as assessed by CTCAE|Number of treatment cycles, dose intensity of components of each treatment regimen, and changes in vital signs and clinical laboratory tests during and following treatment|Phase 2: Arm A [BGB-290 + RT] and Arm B [BGB-290 + RT + TMZ]|Phase 2 Arm C [BGB-290 + TMZ]|Pharmacokinetic (PK) parameters of BGB-290 of steady state Ctrough|Modified disease control rate (DCR). (Arms A and B)|Disease control rate (Arm C)|Objective response rate (ORR)|Clinical benefit rate (CBR).|Duration of response (DOR).|Progression free survival (PFS).|Overall survival (OS)|Objective response rate (ORR).|Clinical benefit rate (CBR)|Duration of response (DOR)|Progression free survival (PFS)|PK parameter of BGB-290 of steady state Ctrough|PK parameter of BGB-290 (Cmax)|Disease control rate (DCR).","BeiGene USA, Inc.|BeiGene","All","18 Years to 99 Years   (Adult, Older Adult)","Phase 1|Phase 2","300","Industry","Interventional","Allocation: Non-Randomized|Intervention Model: Parallel Assignment|Masking: None (Open Label)|Primary Purpose: Treatment","BGB-290-104","June 30, 2017","June 30, 2021","October 31, 2021","May 12, 2017","null","June 29, 2018","Center for Neurosciences, Tucson, Arizona, United States|Sarah Cannon Research Institute at Health One, Denver, Colorado, United States|Massachusetts General Hospital, Boston, Massachusetts, United States|Dana Farber Cancer Institute, Boston, Massachusetts, United States|Henry Ford Health Systems, Detroit, Michigan, United States|Washington University, Saint Louis, Missouri, United States|Cleveland Clinic, Cleveland, Ohio, United States|The Ohio State University, Columbus, Ohio, United States|University of Oklahoma Health Sciences Center (Stephenson Cancer Center), Oklahoma City, Oklahoma, United States|Thomas Jefferson University, Philadelphia, Pennsylvania, United States|SCRI / Tennessee Oncology, Nashville, Tennessee, United States|Huntsman Cancer Center, Salt Lake City, Utah, United States|University of Virginia Health Systems, Charlottesville, Virginia, United States","","https://ClinicalTrials.gov/show/NCT03150862"
358,"NCT03452774","SYNERGY-AI: Artificial Intelligence Based Precision Oncology Clinical Trial Matching and Registry",,"Recruiting","No Results Available","Cancer, Metastatic|Cancer|Cancer of Pancreas|Cancer of Liver|Cancer of Stomach|Cancer Liver|Cancer of Rectum|Cancer of Kidney|Cancer of Esophagus|Cancer of Cervix|Cancer of Colon|Cancer of Larynx|Cancer, Lung|Cancer, Breast|Cancer, Advanced|Cancer Prostate|Cancer of Neck|Cancer of Skin|Neuroendocrine Tumors|Carcinoma|Mismatch Repair Deficiency|BRCA Gene Rearrangement|Non Hodgkin Lymphoma|Leukemia|Non Small Cell Lung Cancer|Cholangiocarcinoma|Glioblastoma|Central Nervous System Tumor|Melanoma|Urothelial Carcinoma|Bladder Cancer|Ovarian Cancer|Endometrial Cancer|Testicular Cancer|Breast Cancer","Other: Clinical Trial Matching","Proportion of patients Eligible for CTE versus Actual CTE|Impact of CTE on Overall Survival (OS), estimated by Kaplan-Meier and Cox multivariable survival analysis|Impact of CTE on Progression-Free Survival (PFS), estimated by Kaplan-Meier and Cox multivariable survival analysis|Identification of Barriers to CTE|Real World Data Analytics|Virtual Tumor Board Utilization|Time from Intervention to Actual CTE (months)","Massive Bio, Inc.","All","Child, Adult, Older Adult","","1500","Industry","Observational","Observational Model: Cohort|Time Perspective: Prospective","SYNERGY-AI","January 1, 2018","December 2021","December 2022","March 2, 2018","null","March 2, 2018","Massive Bio, Inc, New York, New York, United States","","https://ClinicalTrials.gov/show/NCT03452774"
359,"NCT03050268","Familial Investigations of Childhood Cancer Predisposition","SJFAMILY","Recruiting","No Results Available","Acute Leukemia|Adenomatous Polyposis|Adrenocortical Carcinoma|AML|BAP1 Tumor Predisposition Syndrome|Carney Complex|Choroid Plexus Carcinoma|Constitutional Mismatch Repair Deficiency Syndrome|Diamond-Blackfan Anemia|DICER1 Syndrome|Dyskeratosis Congenita|Emberger Syndrome|Familial Acute Myeloid Leukemia|Familial Adenomatous Polyposis|Fanconi Anemia|Familial Cancer|Familial Wilms Tumor|Familial Neuroblastoma|GIST|Hereditary Breast and Ovarian Cancer|Hereditary Paraganglioma-Pheochromocytoma Syndrome|Hodgkin Lymphoma|Juvenile Polyposis|Li-Fraumeni Syndrome|Lynch Syndrome|MDS|Melanoma Syndrome|Multiple Endocrine Neoplasia Type 1|Multiple Endocrine Neoplasia Type 2|Neuroblastoma|Neurofibromatosis Type 1|Neurofibromatosis Type II|Nevoid Basal Cell Carcinoma Syndrome|Non Hodgkin Lymphoma|Noonan Syndrome and Other Rasopathy|Overgrowth Syndromes|Pancreatic Cancer|Peutz-Jeghers Syndrome|Pheochromocytoma/Paraganglioma|PTEN Hamartoma Tumor Syndrome|Retinoblastoma|Rhabdoid Tumor Predisposition Syndrome|Rhabdomyosarcoma|Rothmund-Thomson Syndrome|Tuberous Sclerosis|Von Hippel-Lindau Disease","","Identification of novel cancer predisposing genes","St. Jude Children's Research Hospital","All","Child, Adult, Older Adult","","3000","Other","Observational","Observational Model: Family-Based|Time Perspective: Prospective","SJFAMILY","April 6, 2017","March 31, 2037","March 31, 2037","February 10, 2017","null","January 5, 2018","St. Jude Children's Research Hospital, Memphis, Tennessee, United States","","https://ClinicalTrials.gov/show/NCT03050268"
360,"NCT02858895","Convection-Enhanced Delivery (CED) of MDNA55 in Adults With Recurrent or Progressive Glioblastoma",,"Recruiting","No Results Available","Glioblastoma|Grade IV Astrocytoma|Glioblastoma Multiforme|Grade IV Glioma","Drug: MDNA55","Objective Response Rate (ORR)|Overall Survival (OS)|Progression Free Survival (PFS)","Medicenna Therapeutics, Inc.","All","18 Years and older   (Adult, Older Adult)","Phase 2","52","Industry","Interventional","Intervention Model: Single Group Assignment|Masking: None (Open Label)|Primary Purpose: Treatment","MDNA55-05","October 2016","October 2018","July 2019","August 8, 2016","null","May 18, 2018","University of California San Francisco, San Francisco, California, United States|John Wayne Cancer Institute at Providence Saint John's Health Center, Santa Monica, California, United States|Boca Raton Regional Hospital, Boca Raton, Florida, United States|Weill Cornell Medical Center - New York Presbyterian, New York, New York, United States|Duke University Medical Center, Durham, North Carolina, United States|Cleveland Clinic, Cleveland, Ohio, United States|Oregon Health & Science University, Portland, Oregon, United States|Hospital of the University of Pennsylvania, Philadelphia, Pennsylvania, United States|Cancer Therapy and Research Center at The University of Texas Health Science Center at San Antonio, San Antonio, Texas, United States|Mazovian Brodnowski Hospital, Warsaw, Poland","","https://ClinicalTrials.gov/show/NCT02858895"
361,"NCT01986348","A Phase 2 Study Evaluating the Efficacy and Safety of Selinexor (KPT-330) in Patients With Recurrent Gliomas","KING","Recruiting","No Results Available","Glioblastoma|Glioma","Drug: Selinexor","Determine the efficacy of selinexor in adults with recurrent GBM|Response to therapy|Safety and tolerability of Selinexor","Karyopharm Therapeutics Inc","All","18 Years and older   (Adult, Older Adult)","Phase 2","110","Industry","Interventional","Allocation: Randomized|Intervention Model: Single Group Assignment|Masking: None (Open Label)|Primary Purpose: Treatment","KCP-330-004","March 2014","December 2018","December 2018","November 18, 2013","null","June 8, 2018","Massachusetts General Hospital, Boston, Massachusetts, United States|Dana Farber Cancer Institute, Center for Neuro-Oncology, Boston, Massachusetts, United States|Columbia University, Herbert Irving Comprehensive Cancer Center, New York, New York, United States|The Phase I Unit, Dept. of Oncology, Rigshospitalet, Copenhagen, Denmark|University of Groningen Faculty of Medical Sciences, Medical Oncology, Groningen, Netherlands|Erasmus MC-Daniel den Hoed Cancer Center- Neuro-Oncology Unit, Rotterdam, Netherlands","","https://ClinicalTrials.gov/show/NCT01986348"
362,"NCT03390569","Exercise in Patients With Glioblastoma",,"Recruiting","No Results Available","Glioblastoma","Behavioral: Exercise","Progression-Free Survival|Cognitive Decline|Cognitive Complaints|Overall survival|Personality Changes|Quality of Life|Mood|Interference with valued activities and interests|Sleep Quality|Physical Function","University Health Network, Toronto|Canadian Cancer Society Research Institute (CCSRI)|University of Toronto|McMaster University|University of British Columbia","All","18 Years and older   (Adult, Older Adult)","Not Applicable","72","Other","Interventional","Intervention Model: Single Group Assignment|Masking: None (Open Label)|Primary Purpose: Supportive Care","16-5922","August 29, 2017","June 2019","December 2020","January 4, 2018","null","January 4, 2018","Princess Margaret Hospital, University Health Network, Toronto, Ontario, Canada","","https://ClinicalTrials.gov/show/NCT03390569"
363,"NCT02100891","Phase 2 STIR Trial: Haploidentical Transplant and Donor Natural Killer Cells for Solid Tumors","STIR","Recruiting","No Results Available","Ewing Sarcoma|Neuroblastoma|Rhabdomyosarcoma|Osteosarcoma|CNS Tumors","Procedure: Allogeneic HCT|Drug: Donor NK Cell Infusion","Disease-control rate|Overall survival","Monica Thakar|Medical College of Wisconsin","All","Child, Adult, Older Adult","Phase 2","20","Other","Interventional","Intervention Model: Single Group Assignment|Masking: None (Open Label)|Primary Purpose: Treatment","STIR Trial","March 2014","December 2019","December 2019","April 1, 2014","null","June 1, 2018","Children's Hospital of Wisconsin, Milwaukee, Wisconsin, United States|Froedtert and The Medical College of Wisconsin, Milwaukee, Wisconsin, United States","","https://ClinicalTrials.gov/show/NCT02100891"
364,"NCT02780804","Entinostat in Treating Pediatric Patients With Recurrent or Refractory Solid Tumors",,"Recruiting","No Results Available","Childhood Brain Stem Neoplasm|Childhood Lymphoma|Childhood Solid Neoplasm|Pineal Region Neoplasm|Recurrent Childhood Central Nervous System Neoplasm|Recurrent Childhood Visual Pathway Glioma|Refractory Central Nervous System Neoplasm","Drug: Entinostat|Other: Laboratory Biomarker Analysis|Other: Pharmacological Study","Maximum tolerated dose defined as the maximum dose at which fewer than one-third of patients experience dose limiting toxicity during cycle 1 of therapy|Incidence of adverse events as described and graded using CTCAE version 5.0|Changes in pharmacokinetic (PK) parameters|Antitumor activity of entinostat|Change in histone H3 and H4 acetylation assessed in peripheral blood mononuclear cells","National Cancer Institute (NCI)","All","12 Months to 21 Years   (Child, Adult)","Phase 1","36","NIH","Interventional","Intervention Model: Single Group Assignment|Masking: None (Open Label)|Primary Purpose: Treatment","NCI-2016-00708|ADVL1513|UM1CA097452","December 26, 2016","April 30, 2022","null","May 24, 2016","null","July 6, 2018","Children's Hospital of Alabama, Birmingham, Alabama, United States|COG Phase I Consortium, Arcadia, California, United States|Children's Hospital Los Angeles, Los Angeles, California, United States|Children's Hospital of Orange County, Orange, California, United States|UCSF Medical Center-Mission Bay, San Francisco, California, United States|Children's Hospital Colorado, Aurora, Colorado, United States|Children's National Medical Center, Washington, District of Columbia, United States|Children's Healthcare of Atlanta - Egleston, Atlanta, Georgia, United States|Lurie Children's Hospital-Chicago, Chicago, Illinois, United States|Riley Hospital for Children, Indianapolis, Indiana, United States|Dana-Farber Cancer Institute, Boston, Massachusetts, United States|C S Mott Children's Hospital, Ann Arbor, Michigan, United States|University of Minnesota/Masonic Cancer Center, Minneapolis, Minnesota, United States|Washington University School of Medicine, Saint Louis, Missouri, United States|Columbia University/Herbert Irving Cancer Center, New York, New York, United States|Cincinnati Children's Hospital Medical Center, Cincinnati, Ohio, United States|Oregon Health and Science University, Portland, Oregon, United States|Children's Hospital of Philadelphia, Philadelphia, Pennsylvania, United States|Children's Hospital of Pittsburgh of UPMC, Pittsburgh, Pennsylvania, United States|St. Jude Children's Research Hospital, Memphis, Tennessee, United States|Baylor College of Medicine/Dan L Duncan Comprehensive Cancer Center, Houston, Texas, United States|Seattle Children's Hospital, Seattle, Washington, United States","","https://ClinicalTrials.gov/show/NCT02780804"
365,"NCT02255461","Palbociclib Isethionate in Treating Younger Patients With Recurrent, Progressive, or Refractory Central Nervous System Tumors",,"Recruiting","No Results Available","Childhood Choroid Plexus Tumor|Childhood Ependymoblastoma|Childhood Grade III Meningioma|Childhood High-grade Cerebellar Astrocytoma|Childhood High-grade Cerebral Astrocytoma|Childhood Medulloepithelioma|Recurrent Childhood Anaplastic Astrocytoma|Recurrent Childhood Anaplastic Oligoastrocytoma|Recurrent Childhood Anaplastic Oligodendroglioma|Recurrent Childhood Brain Stem Glioma|Recurrent Childhood Cerebellar Astrocytoma|Recurrent Childhood Cerebral Astrocytoma|Recurrent Childhood Giant Cell Glioblastoma|Recurrent Childhood Glioblastoma|Recurrent Childhood Gliomatosis Cerebri|Recurrent Childhood Gliosarcoma|Recurrent Childhood Medulloblastoma|Recurrent Childhood Pineoblastoma|Recurrent Childhood Supratentorial Primitive Neuroectodermal Tumor","Drug: palbociclib isethionate|Other: pharmacological study|Other: laboratory biomarker analysis","MTD of palbociclib isethionate defined as the highest dose level at which six patients have been treated with at most one patient experiencing a dose limiting toxicity and the next higher dose level has been determined to be too toxic|Incidence of adverse events|Objective responses (partial response + complete response)|Individual pharmacokinetic parameters of interest, such as apparent volume of the central compartment (Vc/F), elimination rate constant (Ke), half-life (t1/2), apparent oral clearance (CL/F), and area under the plasma concentration time curve (AUC)|Population pharmacokinetic parameters","Pediatric Brain Tumor Consortium|National Cancer Institute (NCI)","All","4 Years to 21 Years   (Child, Adult)","Phase 1","55","Other|NIH","Interventional","Intervention Model: Single Group Assignment|Masking: None (Open Label)|Primary Purpose: Treatment","PBTC-042|U01CA081457","October 2014","December 31, 2018","December 31, 2018","October 2, 2014","null","September 28, 2017","Childrens Hospital Los Angeles, Los Angeles, California, United States|Lucile Packard Children Hospital Stanford University, Palo Alto, California, United States|Childrens National Medical Center, Washington, D.C., District of Columbia, United States|Lurie Childrens Hospital-Chicago, Chicago, Illinois, United States|Memorial Sloan Kettering Cancer Center, New York, New York, United States|Duke University Medical Center, Durham, North Carolina, United States|Cincinnati Children Hospital Medical Center, Cincinnati, Ohio, United States|Children Hospital of Pittsburgh of UPMC, Pittsburgh, Pennsylvania, United States|St. Jude Children Research Hospital, Memphis, Tennessee, United States|Texas Childrens Hospital, Houston, Texas, United States|Seattle Children Hospital, Seattle, Washington, United States","","https://ClinicalTrials.gov/show/NCT02255461"
366,"NCT02929147","Comparison of Efficacy and Safety of the Postoperative Analgesia Methods",,"Not yet recruiting","No Results Available","Supratentorial Neoplasms","Drug: Morphine|Drug: Dexketoprofen|Drug: Placebo","Integrated Pulmonary Index (IPI)|Pain intensity measured by Visual Analog Score|Sedation level measured by Ramsay score|Cumulative Morphine consumption","Istanbul University","All","18 Years to 70 Years   (Adult, Older Adult)","Phase 4","90","Other","Interventional","Allocation: Randomized|Intervention Model: Parallel Assignment|Masking: Double (Participant, Investigator)|Primary Purpose: Treatment","Istanbul U","November 2016","November 2017","November 2017","October 11, 2016","null","October 11, 2016","Ozlem Korkmaz Dilmen, Istanbul, Turkey","","https://ClinicalTrials.gov/show/NCT02929147"
367,"NCT03465423","Comparison of Propofol Requirement Between Patients With Pituitary Somatotroph Tumor and With Nonfunctioning Pituitary Tumor in Transsphenoidal Pituitary Surgery Under Total Intravenous Anesthesia",,"Recruiting","No Results Available","Pituitary Tumor","Procedure: Not applicable (measuring subject's effect site concentration of propofol during the induction of general anesthesia)","effect site concentration of propofol","Yonsei University","All","19 Years and older   (Adult, Older Adult)","","62","Other","Observational","Observational Model: Case-Control|Time Perspective: Prospective","4-2017-1241","March 20, 2018","February 10, 2019","February 11, 2019","March 14, 2018","null","May 16, 2018","Associate Professor Department of Anesthesiology and Pain Medicine, Seoul, Korea, Republic of","","https://ClinicalTrials.gov/show/NCT03465423"
368,"NCT03132259","Comparative Low and High Dose of Dexmedethomidine in Pituitary Tumor Removal by Transphenoid Approach",,"Recruiting","No Results Available","Pituitary Tumor","Drug: high dose dexmedethomidine|Drug: low dose dexmedethomidine","Comparative Low and High Dose of Dexmedethomidine in Pituitary Tumor Removal by Transphenoid Approach|Comparative Low and High Dose of Dexmedethomidine in Pituitary Tumor","Mahidol University","All","18 Years to 65 Years   (Adult, Older Adult)","Phase 4","124","Other","Interventional","Allocation: Randomized|Intervention Model: Parallel Assignment|Masking: Quadruple (Participant, Care Provider, Investigator, Outcomes Assessor)|Primary Purpose: Treatment","116/2559","May 2016","May 2017","June 2018","April 27, 2017","null","May 30, 2017","Faculy of Medicine Siriraj hospital Mahidol University, Bangkok, Thailand","","https://ClinicalTrials.gov/show/NCT03132259"
369,"NCT02749227","Pasireotide LAR Therapy of Silent Corticotroph Pituitary Tumors","PASSILCORT","Recruiting","No Results Available","Pituitary Tumor|ACTH-producing Pituitary Tumour","Drug: Pasireotide LAR","Change in plasma Proopiomelanocortin (POMC) levels|Change in pituitary tumor volume","Columbia University","All","18 Years to 80 Years   (Adult, Older Adult)","Phase 2","10","Other","Interventional","Intervention Model: Single Group Assignment|Masking: None (Open Label)|Primary Purpose: Treatment","AAAQ6255|CSOM230GUS44T","July 10, 2017","May 2018","May 2018","April 22, 2016","null","April 12, 2018","Neuroendocrine Unit and Pituitary Center, Columbia University, New York, New York, United States","","https://ClinicalTrials.gov/show/NCT02749227"
370,"NCT02854228","PITUItary Carcinoma or Aggressive Tumors REgistry -Lyon","PITUICARE-Lyon","Recruiting","No Results Available","Pituitary Tumor","","Progression free survival after pituitary surgery according to the clinicopathological classification (HYPOPRONOS)|Correlation between percentage of SSTR expression of the pituitary tumor and somatostatine analogs efficacy.|Correlation between percentage of MGMT expression of the pituitary tumor and tumor response to temozolomide.","Hospices Civils de Lyon","All","Child, Adult, Older Adult","","1300","Other","Observational","Observational Model: Cohort|Time Perspective: Prospective","69HCL16_0506","February 2007","December 2015","December 2020","August 3, 2016","null","August 3, 2016","Groupement Hospitalier Est, Lyon, France, Bron, France","","https://ClinicalTrials.gov/show/NCT02854228"
371,"NCT02419664","Ga-68-DOTATOC -PET in the Management of Pituitary Tumours",,"Recruiting","No Results Available","Pituitary Tumours","Procedure: Gallium-68 DOTATOC PET","SUV max in GA-68 DOTATOC in pituitary tumours in comparison to normal pituitary|Ga-PET uptake in correlation to sst expression in pituitary tumours, measured as SUVmax which is then used to establish statistical relationship with a cell membrane-based sst-immunohistochemistry (IHC) score""|Adverse event registration in association to Ga-68 PET|Detection of tumour recurrence with Ga-PET","Göteborg University|Sahlgrenska University Hospital, Sweden|Uppsala University","All","18 Years and older   (Adult, Older Adult)","Phase 3","45","Other","Interventional","Intervention Model: Single Group Assignment|Masking: None (Open Label)|Primary Purpose: Diagnostic","Ga-PET version 8 (141017)|2010-020482-24","January 2015","May 2018","December 2019","April 17, 2015","null","February 21, 2018","Center of Endocrinology and Metabolism, Sahlgrenska university Hospital, Göteborg, Sweden","","https://ClinicalTrials.gov/show/NCT02419664"
372,"NCT02813044","Effects of Total Intravenous Anesthesia With Propofol-remifentanil Versus Inhalational Anesthesia With Sevoflurane on Quality of Recovery in Patients Undergoing Transsphenoidal Surgery for Pituitary Tumor",,"Recruiting","No Results Available","Pituitary Tumor","Drug: total intravenous anesthesia (TIVA)|Drug: inhalation anesthesia group","QoR-40 score","Yonsei University","All","19 Years and older   (Adult, Older Adult)","Not Applicable","82","Other","Interventional","Allocation: Randomized|Intervention Model: Parallel Assignment|Masking: Double (Participant, Investigator)|Primary Purpose: Other","4-2016-0344","June 16, 2016","June 2018","June 2018","June 24, 2016","null","June 20, 2018","Associate Professor Department of Anesthesiology and Pain Medicine,, Seoul, Korea, Republic of","","https://ClinicalTrials.gov/show/NCT02813044"
373,"NCT00089245","Radiolabeled Monoclonal Antibody Therapy in Treating Patients With Refractory, Recurrent, or Advanced CNS or Leptomeningeal Cancer",,"Recruiting","No Results Available","Brain and Central Nervous System Tumors|Neuroblastoma|Sarcoma","Radiation: iodine I 131 monoclonal antibody 8H9","Number of patients that have treatment related toxicities","Y-mAbs Therapeutics|National Cancer Institute (NCI)|New York University School of Medicine","All","Child, Adult, Older Adult","Phase 1","120","Industry|NIH|Other","Interventional","Intervention Model: Single Group Assignment|Masking: None (Open Label)|Primary Purpose: Treatment","03-133|P30CA008748|MSKCC-03133","July 2004","July 2018","July 2018","August 5, 2004","null","April 17, 2018","Memorial Sloan Kettering Cancer Center, New York, New York, United States","","https://ClinicalTrials.gov/show/NCT00089245"
374,"NCT03471026","Advanced MRI for Posterior Fossa Tumours",,"Not yet recruiting","No Results Available","Cerebellar Mutism|Posterior Fossa Syndrome","Diagnostic Test: Advanced MRI sequences","Diffusion MRI tractography|Arterial Spin Labeling Perfusion MRI|Clinical measure of severity of pCMS","Great Ormond Street Hospital for Children NHS Foundation Trust","All","up to 18 Years   (Child, Adult)","","60","Other","Observational","Observational Model: Case-Control|Time Perspective: Prospective","17NI17","March 2018","March 2020","March 2020","March 20, 2018","null","March 21, 2018","","","https://ClinicalTrials.gov/show/NCT03471026"
