"Rank","NCT Number","Title","Acronym","Status","Study Results","Conditions","Interventions","Outcome Measures","Sponsor/Collaborators","Gender","Age","Phases","Enrollment","Funded Bys","Study Type","Study Designs","Other IDs","Start Date","Primary Completion Date","Completion Date","First Posted","Results First Posted","Last Update Posted","Locations","Study Documents","URL"
310,"NCT02978677","Proton Dose Escalation for Patients With Atypical or Anaplastic Meningiomas","PANAMA","Not yet recruiting","No Results Available","Meningioma","Radiation: Radiotherapy 68 Gy(RBE)|Radiation: Radiotherapy 72 Gy(RBE)|Radiation: Radiotherapy 60 Gy(RBE)","progression-free survival|late toxicity|acute toxicity|overall survival|patterns of recurrence using MRI|quality of life by validated quality of life questionnaires","Technische Universität Dresden|German Cancer Research Center|Radiation Oncology Working Group of the German Cancer Society","All","18 Years and older   (Adult, Older Adult)","Not Applicable","90","Other","Interventional","Allocation: Non-Randomized|Intervention Model: Parallel Assignment|Masking: None (Open Label)|Primary Purpose: Treatment","STR-PANAMA-2015","January 2018","December 2027","December 2028","December 1, 2016","null","June 20, 2017","","","https://ClinicalTrials.gov/show/NCT02978677"
311,"NCT02896335","Palbociclib In Progressive Brain Metastases",,"Recruiting","No Results Available","Metastatic Malignant Neoplasm to Brain","Drug: Palbociclib","Clinical Benefit Rate (Intracranial)|Clinical Benefit Rate (Extracranial)|Intracranial disease progression rate|Extracranial disease progression rate|Overall Survival Rate|Number of Participants with Grade 3 or more hematologic toxicity; grade 3 or more neurologic toxicity","Massachusetts General Hospital|Pfizer","All","18 Years and older   (Adult, Older Adult)","Phase 2","30","Other|Industry","Interventional","Intervention Model: Single Group Assignment|Masking: None (Open Label)|Primary Purpose: Treatment","16-254","November 2016","August 2018","August 2022","September 12, 2016","null","March 8, 2018","Massachusetts General Hospital, Boston, Massachusetts, United States|Dana Farber Cancer Institute, Boston, Massachusetts, United States","","https://ClinicalTrials.gov/show/NCT02896335"
312,"NCT03277638","Laser Interstitial Thermotherapy Combined With Checkpoint Inhibitor for Recurrent Glioblastoma",,"Recruiting","No Results Available","Glioblastoma, Adult","Drug: Pembrolizumab at 7 days prior|Drug: Pembrolizumab at 14 days post|Drug: Pembrolizumab at 35 days post|Procedure: Laser Interstitial Thermotherapy","Phase I Objective: Optimal timing of LITT with pembrolizumab|Phase II Objective: Tumor Response|Progression free survival|overall survival|The proportion of patients who achieve progression free survival at 6 months (PFS6)|The proportion of patients who achieve progression free survival at 12 months (PFS12)|The proportion of patients who achieve progression free survival at 24 months (PFS24)","Case Comprehensive Cancer Center","All","18 Years and older   (Adult, Older Adult)","Phase 1|Phase 2","34","Other","Interventional","Allocation: Randomized|Intervention Model: Parallel Assignment|Masking: None (Open Label)|Primary Purpose: Treatment","CASE3316","November 29, 2017","February 2019","February 2020","September 11, 2017","null","December 20, 2017","University Hospitals, Seidman Cancer Center, Case Comprehensive Cancer Center, Cleveland, Ohio, United States","","https://ClinicalTrials.gov/show/NCT03277638"
313,"NCT02393131","Neurocognitive Outcome of Conformal WBRT w/wo Hippocampal Avoidance for Brain Metastases",,"Recruiting","No Results Available","Metastatic Malignant Neoplasm to Brain","Radiation: Hippocampal avoidance WBRT|Radiation: Conformal WBRT","Hopkins Verbal Learning Test-Revised (HVTL-R) delayed recall score|Neurocognitive function by a standardized neurocognitive battery|Patient reported outcome (Quality of Life questionnaire)|Acute toxicity (Common Toxicity Criteria for Adverse Events version 4)|Late toxicity (Common Toxicity Criteria for Adverse Events version 4)|Intracranial progression (Number of participant with intracranial progression on MRI of brain)|Overall survival","National Taiwan University Hospital","All","20 Years and older   (Adult, Older Adult)","Not Applicable","60","Other","Interventional","Allocation: Randomized|Intervention Model: Parallel Assignment|Masking: Single (Participant)|Primary Purpose: Treatment","201412029RINB","February 2015","August 2018","December 2018","March 19, 2015","null","March 29, 2017","National Taiwan University Hospital, Taipei, Taiwan","","https://ClinicalTrials.gov/show/NCT02393131"
314,"NCT02970448","Expedited Laser Interstitial Thermal Therapy + Chemoradiation For Newly Diagnosed High Grade Gliomas",,"Recruiting","No Results Available","High Grade Glioma","Procedure: LITT|Radiation: Radiation therapy|Drug: Temozolomide","Study safety as determined by the number of patients who experience pre-specified adverse events|Number of patients with adjustments to radiation plan to account for post-LITT tissue distortion","Case Comprehensive Cancer Center","All","18 Years and older   (Adult, Older Adult)","Early Phase 1","45","Other","Interventional","Intervention Model: Single Group Assignment|Masking: None (Open Label)|Primary Purpose: Treatment","CASE4316","May 18, 2017","January 2020","January 2020","November 22, 2016","null","August 24, 2017","Cleveland Clinic Taussig Cancer institute, Case Comprehensive Cancer Center, Cleveland, Ohio, United States","","https://ClinicalTrials.gov/show/NCT02970448"
315,"NCT02285439","Phase I/II Study of MEK162 for Children With Ras/Raf Pathway Activated Tumors",,"Recruiting","No Results Available","Low-Grade Gliomas|Malignant Neoplasms, Brain|Soft Tissue Neoplasms","Drug: MEK162","Response rate|Survival","Children's Hospital Los Angeles|Dana-Farber Cancer Institute","All","1 Year to 18 Years   (Child, Adult)","Phase 1|Phase 2","80","Other","Interventional","Allocation: Non-Randomized|Intervention Model: Parallel Assignment|Masking: None (Open Label)|Primary Purpose: Treatment","ChildrenHLA","April 2016","December 2019","June 2020","November 7, 2014","null","February 2, 2018","Children's Hospital of Alabama, Birmingham, Alabama, United States|Children's Hospital Los Angeles, Los Angeles, California, United States|Children's Hospital of Colorado, Aurora, Colorado, United States|Children's National Heath Systems, Washington, District of Columbia, United States|Children's Healthcare of Atlanta, Atlanta, Georgia, United States|Dana Farber Cancer Institute, Boston, Massachusetts, United States|Children's Hospitals and Clinics of Minnesota-Minneapolis, Minneapolis, Minnesota, United States|Washington University School of Medicine, Saint Louis, Missouri, United States|New York University, New York, New York, United States|Oregon Health and Science University, Portland, Oregon, United States|University of Texas Southwestern Medical, Dallas, Texas, United States|Seattle Children's Hospital, Seattle, Washington, United States","","https://ClinicalTrials.gov/show/NCT02285439"
316,"NCT03222258","Prospective Cohort Study Depending on the Use of Palliative Care for Advanced Stage of Cancer Patients",,"Recruiting","No Results Available","Stage IV Breast Cancer|Stage IV Pancreatic Cancer|Stage IV Colon Cancer|Stage IV Gastric Cancer|Stage IV Lung Cancer|Stage IV Liver Cancer|Malignant Hematologic Neoplasm|Biliary Cancer Metastatic|Pediatric Leukemia|Pediatric Lymphoma|Pediatric Brain Tumor|Pediatric Solid Tumor","Behavioral: Early palliative care|Behavioral: Routine hospice care","Quality of Life Questionnaire - Core 15 items|Mcgill Quality of Life|Pediatric Quality of Life Inventory|Patients survival and Physicians Orders for Life Sustaining Treatment (POLST) documentation|Depression|Level of decision conflict|Understanding the illness|Recognition of health status|Crisis overcoming capability|Daily functional skills in elderly|Medical cost in KRW/person/month|Utilization of healthcare services|Preference of Advance care and Palliative care|M.D. Anderson Symptom Inventory","Seoul National University Hospital|Seoul National University Bundang Hospital|National Cancer Center, Korea|Kyunghee University Medical Center|Severance Hospital|Gyeongsang National University Hospital|Chungnam National University Hospital|Chonbuk National University Hospital|Ewha Womans University Mokdong Hospital|Daegu Fatima Hospital, South Korea|Chonnam National University Hospital|Keimyung University Dongsan Medical Center|Hallym University Medical Center|Asan Medical Center|National Evidence-Based Healthcare Collaborating Agency|National Institute of Health, Korea|National Clinical Research Coordination Center, Seoul, Korea|Ulsan University Hospital","All","Child, Adult, Older Adult","","500","Other","Observational","Observational Model: Cohort|Time Perspective: Prospective","HC15C1391-2","December 17, 2016","June 30, 2019","June 30, 2019","July 19, 2017","null","September 8, 2017","National Cancer Center, Korea, Goyang-si, Gyeonggi-do, Korea, Republic of|Seoul National University Bundang Hospital, Seongnam-si, Gyeonggi-do, Korea, Republic of|Gyeongsang National University Hospital, Jinju-si, Gyeongsangnam-do, Korea, Republic of|Chonbuk National University Hospital, Jeonju, Jeollabuk-do, Korea, Republic of|Chonnam National University Hwasun Hospital, Hwasun, Jeollanam-do, Korea, Republic of|Daegu Fatima Hospital, Daegu, Korea, Republic of|Keimyung University Dongsan Medical Center, Daegu, Korea, Republic of|Chungnam National University Hospital, Daejeon, Korea, Republic of|Kyunghee University Medical Center, Seoul, Korea, Republic of|Seoul National University Hospital, Seoul, Korea, Republic of|Severance Hospital, Seoul, Korea, Republic of|Kangdong Sacred Heart Hospital, Seoul, Korea, Republic of|Asan Medical Center, Seoul, Korea, Republic of|Ewha Womans University Mokdong Hospital, Seoul, Korea, Republic of|Ulsan University Hospital, Ulsan, Korea, Republic of","","https://ClinicalTrials.gov/show/NCT03222258"
317,"NCT02716948","SRS and Nivolumab in Treating Patients With Newly Diagnosed Melanoma Metastases in the Brain or Spine",,"Recruiting","No Results Available","Metastatic Malignant Neoplasm in the Brain|Metastatic Malignant Neoplasm in the Spine|Stage IV Skin Melanoma","Other: Laboratory Biomarker Analysis|Biological: Nivolumab|Radiation: Stereotactic Radiosurgery","Incidence of serious adverse events (SAE) graded according to the National Cancer Institute Common Toxicity Criteria (NCI CTC) version 4.0|Changes in the immune profile of peripheral blood during and after treatment with nivolumab in combination with stereotactic radiosurgery (immune response)|Incidence of toxicity graded according to the NCI CTC 4.0|Local control rate in brain defined as no change in number of lesions at initial treatment in the brain and change on size of targeted lesion is =< 25% from initial measurement|Progression-free survival according to Response Evaluation Criteria in Solid Tumors criteria 1.1|Systematic control rate in spine defined as no change in number of lesions at initial treatment in the spine and change on size of targeted lesion is =< 25% from initial measurement","Sidney Kimmel Comprehensive Cancer Center at Johns Hopkins","All","18 Years and older   (Adult, Older Adult)","Phase 1","90","Other","Interventional","Intervention Model: Single Group Assignment|Masking: None (Open Label)|Primary Purpose: Treatment","J15214|NCI-2016-00370|IRB00086553","March 2016","April 2019","March 2021","March 23, 2016","null","January 23, 2018","Johns Hopkins University/Sidney Kimmel Cancer Center, Baltimore, Maryland, United States","","https://ClinicalTrials.gov/show/NCT02716948"
318,"NCT01793168","Rare Disease Patient Registry & Natural History Study - Coordination of Rare Diseases at Sanford","CoRDS","Recruiting","No Results Available","Rare Disorders|Undiagnosed Disorders|Disorders of Unknown Prevalence|Cornelia De Lange Syndrome|Prenatal Benign Hypophosphatasia|Perinatal Lethal Hypophosphatasia|Odontohypophosphatasia|Adult Hypophosphatasia|Childhood-onset Hypophosphatasia|Infantile Hypophosphatasia|Hypophosphatasia|Kabuki Syndrome|Bohring-Opitz Syndrome|Narcolepsy Without Cataplexy|Narcolepsy-cataplexy|Hypersomnolence Disorder|Idiopathic Hypersomnia Without Long Sleep Time|Idiopathic Hypersomnia With Long Sleep Time|Idiopathic Hypersomnia|Kleine-Levin Syndrome|Kawasaki Disease|Leiomyosarcoma|Leiomyosarcoma of the Corpus Uteri|Leiomyosarcoma of the Cervix Uteri|Leiomyosarcoma of Small Intestine|Acquired Myasthenia Gravis|Addison Disease|Hyperacusis (Hyperacousis)|Juvenile Myasthenia Gravis|Transient Neonatal Myasthenia Gravis|Williams Syndrome|Lyme Disease|Myasthenia Gravis|Marinesco Sjogren Syndrome(Marinesco-Sjogren Syndrome)|Isolated Klippel-Feil Syndrome|Frasier Syndrome|Denys-Drash Syndrome|Beckwith-Wiedemann Syndrome|Emanuel Syndrome|Isolated Aniridia|Beckwith-Wiedemann Syndrome Due to Paternal Uniparental Disomy of Chromosome 11|Beckwith-Wiedemann Syndrome Due to Imprinting Defect of 11p15|Beckwith-Wiedemann Syndrome Due to 11p15 Translocation/Inversion|Beckwith-Wiedemann Syndrome Due to 11p15 Microduplication|Beckwith-Wiedemann Syndrome Due to 11p15 Microdeletion|Axenfeld-Rieger Syndrome|Aniridia-intellectual Disability Syndrome|Aniridia - Renal Agenesis - Psychomotor Retardation|Aniridia - Ptosis - Intellectual Disability - Familial Obesity|Aniridia - Cerebellar Ataxia - Intellectual Disability|Aniridia - Absent Patella|Aniridia|Peters Anomaly - Cataract|Peters Anomaly|Potocki-Shaffer Syndrome|Silver-Russell Syndrome Due to Maternal Uniparental Disomy of Chromosome 11|Silver-Russell Syndrome Due to Imprinting Defect of 11p15|Silver-Russell Syndrome Due to 11p15 Microduplication|Syndromic Aniridia|WAGR Syndrome|Wolf-Hirschhorn Syndrome|4p16.3 Microduplication Syndrome|4p Deletion Syndrome, Non-Wolf-Hirschhorn Syndrome|Autosomal Recessive Stickler Syndrome|Stickler Syndrome Type 2|Stickler Syndrome Type 1|Stickler Syndrome|Mucolipidosis Type 4|X-linked Spinocerebellar Ataxia Type 4|X-linked Spinocerebellar Ataxia Type 3|X-linked Intellectual Disability - Ataxia - Apraxia|X-linked Progressive Cerebellar Ataxia|X-linked Non Progressive Cerebellar Ataxia|X-linked Cerebellar Ataxia|Vitamin B12 Deficiency Ataxia|Toxic Exposure Ataxia|Unclassified Autosomal Dominant Spinocerebellar Ataxia|Thyroid Antibody Ataxia|Sporadic Adult-onset Ataxia of Unknown Etiology|Spinocerebellar Ataxia With Oculomotor Anomaly|Spinocerebellar Ataxia With Epilepsy|Spinocerebellar Ataxia With Axonal Neuropathy Type 2|Spinocerebellar Ataxia Type 8|Spinocerebellar Ataxia Type 7|Spinocerebellar Ataxia Type 6|Spinocerebellar Ataxia Type 5|Spinocerebellar Ataxia Type 4|Spinocerebellar Ataxia Type 37|Spinocerebellar Ataxia Type 36|Spinocerebellar Ataxia Type 35|Spinocerebellar Ataxia Type 34|Spinocerebellar Ataxia Type 32|Spinocerebellar Ataxia Type 31|Spinocerebellar Ataxia Type 30|Spinocerebellar Ataxia Type 3|Spinocerebellar Ataxia Type 29|Spinocerebellar Ataxia Type 28|Spinocerebellar Ataxia Type 27|Spinocerebellar Ataxia Type 26|Spinocerebellar Ataxia Type 25|Spinocerebellar Ataxia Type 23|Spinocerebellar Ataxia Type 22|Spinocerebellar Ataxia Type 21|Spinocerebellar Ataxia Type 20|Spinocerebellar Ataxia Type 2|Spinocerebellar Ataxia Type 19/22|Spinocerebellar Ataxia Type 18|Spinocerebellar Ataxia Type 17|Spinocerebellar Ataxia Type 16|Spinocerebellar Ataxia Type 15/16|Spinocerebellar Ataxia Type 14|Spinocerebellar Ataxia Type 13|Spinocerebellar Ataxia Type 12|Spinocerebellar Ataxia Type 11|Spinocerebellar Ataxia Type 10|Spinocerebellar Ataxia Type 1 With Axonal Neuropathy|Spinocerebellar Ataxia Type 1|Spinocerebellar Ataxia - Unknown|Spinocerebellar Ataxia - Dysmorphism|Non Progressive Epilepsy and/or Ataxia With Myoclonus as a Major Feature|Spectrin-associated Autosomal Recessive Cerebellar Ataxia|Spasticity-ataxia-gait Anomalies Syndrome|Spastic Ataxia With Congenital Miosis|Spastic Ataxia - Corneal Dystrophy|Spastic Ataxia|Rare Hereditary Ataxia|Rare Ataxia|Recessive Mitochondrial Ataxia Syndrome|Progressive Epilepsy and/or Ataxia With Myoclonus as a Major Feature|Posterior Column Ataxia - Retinitis Pigmentosa|Post-Stroke Ataxia|Post-Head Injury Ataxia|Post Vaccination Ataxia|Polyneuropathy - Hearing Loss - Ataxia - Retinitis Pigmentosa - Cataract|Muscular Atrophy - Ataxia - Retinitis Pigmentosa - Diabetes Mellitus|Non-progressive Cerebellar Ataxia With Intellectual Disability|Non-hereditary Degenerative Ataxia|Paroxysmal Dystonic Choreathetosis With Episodic Ataxia and Spasticity|Olivopontocerebellar Atrophy - Deafness|NARP Syndrome|Myoclonus - Cerebellar Ataxia - Deafness|Multiple System Atrophy, Parkinsonian Type|Multiple System Atrophy, Cerebellar Type|Multiple System Atrophy|Maternally-inherited Leigh Syndrome|Machado-Joseph Disease Type 3|Machado-Joseph Disease Type 2|Machado-Joseph Disease Type 1|Lethal Ataxia With Deafness and Optic Atrophy|Leigh Syndrome|Leukoencephalopathy With Mild Cerebellar Ataxia and White Matter Edema|Leukoencephalopathy - Ataxia - Hypodontia - Hypomyelination|Leigh Syndrome With Nephrotic Syndrome|Leigh Syndrome With Leukodystrophy|Leigh Syndrome With Cardiomyopathy|Late-onset Ataxia With Dementia|Intellectual Disability-hyperkinetic Movement-truncal Ataxia Syndrome|Infection or Post Infection Ataxia|Infantile-onset Autosomal Recessive Nonprogressive Cerebellar Ataxia|Infantile Onset Spinocerebellar Ataxia|GAD Ataxia|Hereditary Episodic Ataxia|Gliadin/Gluten Ataxia|Friedreich Ataxia|Fragile X-associated Tremor/Ataxia Syndrome|Familial Paroxysmal Ataxia|Exposure to Medications Ataxia|Episodic Ataxia With Slurred Speech|Episodic Ataxia Unknown Type|Episodic Ataxia Type 7|Episodic Ataxia Type 6|Episodic Ataxia Type 5|Episodic Ataxia Type 4|Episodic Ataxia Type 3|Episodic Ataxia Type 1|Epilepsy and/or Ataxia With Myoclonus as Major Feature|Early-onset Spastic Ataxia-neuropathy Syndrome|Early-onset Progressive Neurodegeneration - Blindness - Ataxia - Spasticity|Early-onset Cerebellar Ataxia With Retained Tendon Reflexes|Early-onset Ataxia With Dementia|Childhood-onset Autosomal Recessive Slowly Progressive Spinocerebellar Ataxia|Dilated Cardiomyopathy With Ataxia|Cataract - Ataxia - Deafness|Cerebellar Ataxia, Cayman Type|Cerebellar Ataxia With Peripheral Neuropathy|Cerebellar Ataxia - Hypogonadism|Cerebellar Ataxia - Ectodermal Dysplasia|Cerebellar Ataxia - Areflexia - Pes Cavus - Optic Atrophy - Sensorineural Hearing Loss|Brain Tumor Ataxia|Brachydactyly - Nystagmus - Cerebellar Ataxia|Benign Paroxysmal Tonic Upgaze of Childhood With Ataxia|Autosomal Recessive Syndromic Cerebellar Ataxia|Autosomal Recessive Spastic Ataxia With Leukoencephalopathy|Autosomal Recessive Spastic Ataxia of Charlevoix-Saguenay|Autosomal Recessive Spastic Ataxia - Optic Atrophy - Dysarthria|Autosomal Recessive Spastic Ataxia|Autosomal Recessive Metabolic Cerebellar Ataxia|Autosomal Dominant Spinocerebellar Ataxia Due to Repeat Expansions That do Not Encode Polyglutamine|Autosomal Recessive Ataxia, Beauce Type|Autosomal Recessive Ataxia Due to Ubiquinone Deficiency|Autosomal Recessive Ataxia Due to PEX10 Deficiency|Autosomal Recessive Degenerative and Progressive Cerebellar Ataxia|Autosomal Recessive Congenital Cerebellar Ataxia Due to MGLUR1 Deficiency|Autosomal Recessive Congenital Cerebellar Ataxia Due to GRID2 Deficiency|Autosomal Recessive Congenital Cerebellar Ataxia|Autosomal Recessive Cerebellar Ataxia-pyramidal Signs-nystagmus-oculomotor Apraxia Syndrome|Autosomal Recessive Cerebellar Ataxia-epilepsy-intellectual Disability Syndrome Due to WWOX Deficiency|Autosomal Recessive Cerebellar Ataxia-epilepsy-intellectual Disability Syndrome Due to TUD Deficiency|Autosomal Recessive Cerebellar Ataxia-epilepsy-intellectual Disability Syndrome Due to KIAA0226 Deficiency|Autosomal Recessive Cerebellar Ataxia-epilepsy-intellectual Disability Syndrome|Autosomal Recessive Cerebellar Ataxia With Late-onset Spasticity|Autosomal Recessive Cerebellar Ataxia Due to STUB1 Deficiency|Autosomal Recessive Cerebellar Ataxia Due to a DNA Repair Defect|Autosomal Recessive Cerebellar Ataxia - Saccadic Intrusion|Autosomal Recessive Cerebellar Ataxia - Psychomotor Retardation|Autosomal Recessive Cerebellar Ataxia - Blindness - Deafness|Autosomal Recessive Cerebellar Ataxia|Autosomal Dominant Spinocerebellar Ataxia Due to a Polyglutamine Anomaly|Autosomal Dominant Spinocerebellar Ataxia Due to a Point Mutation|Autosomal Dominant Spinocerebellar Ataxia Due to a Channelopathy|Autosomal Dominant Spastic Ataxia Type 1|Autosomal Dominant Spastic Ataxia|Autosomal Dominant Optic Atrophy|Ataxia-telangiectasia Variant|Ataxia-telangiectasia|Autosomal Dominant Cerebellar Ataxia, Deafness and Narcolepsy|Autosomal Dominant Cerebellar Ataxia Type 4|Autosomal Dominant Cerebellar Ataxia Type 3|Autosomal Dominant Cerebellar Ataxia Type 2|Autosomal Dominant Cerebellar Ataxia Type 1|Autosomal Dominant Cerebellar Ataxia|Ataxia-telangiectasia-like Disorder|Ataxia-intellectual Disability-oculomotor Apraxia-cerebellar Cysts Syndrome|Ataxia-deafness-intellectual Disability Syndrome|Ataxia With Vitamin E Deficiency|Ataxia With Dementia|Ataxia Neuropathy Spectrum|Ataxia - Tapetoretinal Degeneration|Ataxia - Photosensitivity - Short Stature|Ataxia - Pancytopenia|Ataxia - Oculomotor Apraxia Type 1|Ataxia - Hypogonadism - Choroidal Dystrophy|Ataxia - Other|Ataxia - Genetic Diagnosis - Unknown|Acquired Ataxia|Adult-onset Autosomal Recessive Cerebellar Ataxia|Alcohol Related Ataxia|Multiple Endocrine Neoplasia|Multiple Endocrine Neoplasia Type II|Multiple Endocrine Neoplasia Type 1|Multiple Endocrine Neoplasia Type 2|Multiple Endocrine Neoplasia, Type IV|Multiple Endocrine Neoplasia, Type 3|Multiple Endocrine Neoplasia (MEN) Syndrome|Multiple Endocrine Neoplasia Type 2B|Multiple Endocrine Neoplasia Type 2A|Atypical Hemolytic Uremic Syndrome|Atypical HUS|Wiedemann-Steiner Syndrome|Breast Implant-Associated Anaplastic Large Cell Lymphoma|Autoimmune/Inflammatory Syndrome Induced by Adjuvants (ASIA)|Hemophagocytic Lymphohistiocytosis|Behcet's Disease","","To accelerate research into rare disorders by connecting individuals who are interested in research and who have been diagnosed with a rare disorder (or a disorder of unknown prevalence, or who are undiagnosed) with researchers who study rare diseases.","Sanford Health|National Ataxia Foundation|International WAGR Syndrome Association|4p- Support Group|ML4 Foundation|Cornelia de Lange Syndrome Foundation|Stickler Involved People|Kawasaki Disease Foundation|Klippel-Feil Syndrome Alliance|Klippel-Feil Syndrome Freedom|Hyperacusis Research Limited|Hypersomnia Foundation|Kabuki Syndrome Network|Kleine-Levin Syndrome Foundation|Leiomyosarcoma Direct Research Foundation|Marinesco-Sjogren Syndrome Support Group|Mucolipidosis Type IV (ML4) Foundation|People with Narcolepsy 4 People with Narcolepsy (PWN4PWN)|Soft Bones Incorporated|American Multiple Endocrine Neoplasia Support|Atypical Hemolytic Uremic Syndrome Foundation|All Things Kabuki|Wiedemann-Steiner Syndrome Foundation|Breast Implant Victim Advocates|PROS Foundation|American Behcet's Disease Association","All","Child, Adult, Older Adult","","20000","Other","Observational","Observational Model: Case-Only|Time Perspective: Prospective","03-10-014|Hypersomnia Foundation|National Ataxia Foundation|4p- Support Group|CdLS Foundation|Hyperacusis Research Limited|Kabuki Syndrome Network|Kawasaki Disease Foundation|Klippel-Feil Syndrome Freedom|Leiomyosarcoma Direct Research|MSS Support Group|ML4 Foundation|Stickler Involved People|IWSA|Soft Bones|PWN4PWN|aHUS|Klippel-Feil Syndrome Alliance|American MEN Support|Kleine-Levin Syndrome|All Things Kabuki|WSS Foundation|BIVA|ABDA|PROS Foundation (HLH)","July 2010","December 2100","December 2100","February 15, 2013","null","October 2, 2017","Sanford Health, Sioux Falls, South Dakota, United States","","https://ClinicalTrials.gov/show/NCT01793168"
319,"NCT02774291","Anti-ESO (Cancer/Test Antigen) mTCR-transduced Autologous Peripheral Blood Lymphocytes and Combination Chemotherapy in Treating Patients With Metastatic Cancer That Expresses NY-ESO-1",,"Recruiting","No Results Available","HLA-A2 Positive Cells Present|Metastatic Malignant Neoplasm|Metastatic Malignant Neoplasm in the Brain","Biological: Aldesleukin|Biological: Anti-thyroglobulin mTCR-transduced Autologous Peripheral Blood Lymphocytes|Drug: Cyclophosphamide|Biological: Filgrastim|Drug: Fludarabine Phosphate|Other: Laboratory Biomarker Analysis","Incidence of toxicity, graded according to the National Cancer Institute Common Terminology Criteria for Adverse Events version 4.0|In vivo survival of TCR gene-engineered cells|Objective response rate, graded according to RECIST criteria","Albert Einstein College of Medicine, Inc.|National Cancer Institute (NCI)","All","18 Years to 66 Years   (Adult, Older Adult)","Not Applicable","10","Other|NIH","Interventional","Intervention Model: Single Group Assignment|Masking: None (Open Label)|Primary Purpose: Treatment","2015-5254|NCI-2015-01781|P30CA013330","August 2016","January 2018","January 2018","May 17, 2016","null","January 10, 2018","Albert Einstein College of Medicine, Bronx, New York, United States","","https://ClinicalTrials.gov/show/NCT02774291"
