"Rank","NCT Number","Title","Acronym","Status","Study Results","Conditions","Interventions","Outcome Measures","Sponsor/Collaborators","Gender","Age","Phases","Enrollment","Funded Bys","Study Type","Study Designs","Other IDs","Start Date","Primary Completion Date","Completion Date","First Posted","Results First Posted","Last Update Posted","Locations","Study Documents","URL"
192,"NCT02208362","Genetically Modified T-cells in Treating Patients With Recurrent or Refractory Malignant Glioma",,"Recruiting","No Results Available","Malignant Glioma|Refractory Brain Neoplasm|Recurrent Brain Neoplasm|Glioblastoma","Biological: IL13Rα2-specific, hinge-optimized, 41BB-costimulatory CAR/truncated CD19-expressing Autologous T lymphocytes|Other: laboratory biomarker analysis|Other: quality-of-life assessment|Procedure: Magnetic Resonance Imaging|Procedure: Magnetic Resonance Spectroscopic Imaging|Biological: Vaccine Therapy|Other: Laboratory Biomarker Analysis|Other: Quality of Life Assessment","Incidence of grade 3 toxicity, graded using the National Cancer Institute (NCI) Common Toxicity Criteria for Adverse Events (CTCAE) version 4.0, the revised cytokine release syndrome grading system as well as the modified neurological grading system|Incidence of DLT, graded using NCI CTCAE version 4.0|Incidence of toxicities, graded using NCI CTCAE version 4.0 as well as the modified neurological grading system|Changes in largest length of tumor|Changes in cytokine levels|Changes in CAR T cell levels|Progression free survival|Disease response by the Response Assessment in Neuro-Oncology criteria|Overall survival (OS)|Changes in quality of life|T cell detection in tumor|IL13Ra2 antigen expression levels|Disease response from intraventricular infusion following progression after intracranial infusion (stratum 1 and 2)","City of Hope Medical Center|National Cancer Institute (NCI)|Gateway for Cancer Research|Mustang Bio, Inc.","All","12 Years to 75 Years   (Child, Adult, Older Adult)","Phase 1","92","Other|NIH","Interventional","Allocation: Non-Randomized|Intervention Model: Parallel Assignment|Masking: None (Open Label)|Primary Purpose: Treatment","13384|NCI-2014-01488|R01FD005129","May 18, 2015","May 2020","May 2020","August 5, 2014","null","May 1, 2018","City of Hope Medical Center, Duarte, California, United States","","https://ClinicalTrials.gov/show/NCT02208362"
193,"NCT02919332","Delayed 18F-FDG PET/CT in Improving Visualization of Brain Tumors in Patients With Glioblastoma",,"Recruiting","No Results Available","Glioblastoma|Glioma","Procedure: Computed Tomography|Radiation: Fludeoxyglucose F-18|Procedure: Positron Emission Tomography","Tumor-to-background ratio on delayed scans (240 min after injection)|Tumor-to-background ratio on standard scans (60 min after injection)|Standard uptake value comparison","Jonsson Comprehensive Cancer Center|National Cancer Institute (NCI)","All","18 Years to 99 Years   (Adult, Older Adult)","","100","Other|NIH","Observational","Observational Model: Cohort|Time Perspective: Prospective","16-000600|NCI-2016-01214|16-000600 JCCCID655|P30CA016042","June 8, 2016","June 2021","June 2022","September 29, 2016","null","October 13, 2017","UCLA / Jonsson Comprehensive Cancer Center, Los Angeles, California, United States","","https://ClinicalTrials.gov/show/NCT02919332"
194,"NCT02343406","Adult Study: ABT-414 Alone or ABT-414 Plus Temozolomide vs. Lomustine or Temozolomide for Recurrent Glioblastoma Pediatric Study: Evaluation of ABT-414 in Children With High Grade Gliomas","INTELLANCE 2","Recruiting","No Results Available","Glioblastoma Multiforme","Drug: Lomustine|Drug: ABT-414|Drug: Temozolomide","Pediatric study: Maximum observed serum concentration (Cmax) for ABT-414|Adult study: Progression Free Survival (PFS)|Pediatric study: AUC for Cys-mcMMAF (toxin, identified as a metabolite of ABT-414)|Pediatric study: Half-life (t1/2) observed for ABT-414|Pediatric study: Area Under the Concentration-time Curve (AUC) observed for ABT-414|Pediatric study: Maximum observed plasma concentration (Cmax) for Cys-mcMMAF (toxin, identified as a metabolite of ABT-414)|Pediatric study: t1/2 for Cys-mcMMAF (toxin, identified as a metabolite of ABT-414)|Adult study: Overall Survival (OS)|Pediatric study: Safety including toxicities according to CTCAE criteria|Pediatric study: Objective response rate, best response rate and duration of response based on RANO criteria|Pediatric study: Overall survival, Time to progression and Time to progression-free survival|Adult study: Overall Response Rate (ORR)|Pediatric study: Changes in neurological status and function (including PedsQL cancer module)|Adult study: Overall Survival in the subgroup with Epithelial Growth Factor Receptor (EGFRvIII) mutation","AbbVie|European Organisation for Research and Treatment of Cancer - EORTC","All","up to 99 Years   (Child, Adult, Older Adult)","Phase 2","260","Industry|Other","Interventional","Allocation: Randomized|Intervention Model: Parallel Assignment|Masking: None (Open Label)|Primary Purpose: Treatment","M14-483|2014-004438-24|EORTC 1410-BTG","February 11, 2015","December 27, 2019","June 11, 2020","January 22, 2015","null","May 16, 2018","Lucile Packard Children's Hosp, Palo Alto, California, United States|Univ California, San Francisco, San Francisco, California, United States|Univ of Colorado Cancer Center, Aurora, Colorado, United States|Univ of Colorado Cancer Center, Aurora, Colorado, United States|Rush University Medical Center, Chicago, Illinois, United States|Dana-Farber Cancer Institute, Boston, Massachusetts, United States|Cleveland Clinic Foundation, Cleveland, Ohio, United States|University of Pittsburgh MC, Pittsburgh, Pennsylvania, United States|Tennessee Oncology, PLLC, Nashville, Tennessee, United States|Tennessee Oncology-Sarah Cannon Research Institute, Nashville, Tennessee, United States|UT Southwestern Medical Center, Dallas, Texas, United States|Swedish Medical Center, Seattle, Washington, United States|Port Macquarie Base Hospital, Port Macquarie, New South Wales, Australia|Sydney Children's Hospital, Randwick, New South Wales, Australia|Royal North Shore Hospital, Saint Leonards, New South Wales, Australia|Calvary Mater Newcastle, Waratah, New South Wales, Australia|Southern Medical Day Care Ctr, Wollongong, New South Wales, Australia|Royal Brisbane and Women's Hospital, Herston, Queensland, Australia|Royal Adelaide Hospital, Adelaide, South Australia, Australia|Royal Hobart Hospital, Hobart, Tasmania, Australia|Barwon Health, Univ Hosp Geelo, Geelong, Victoria, Australia|Royal Children's Hospital, Melbourne, Victoria, Australia|University Hospital St. Polten, St. Pölten, Niederosterreich, Austria|LKH-Univ. Klinikum Graz, Graz, Austria|Kepler Universitatskliniken, Linz, Austria|Cliniques Universitaires Saint Luc, Woluwe-Saint-Lambert, Bruxelles-Capitale, Belgium|Grand Hôpital de Charleroi, Charleroi, Hainaut, Belgium|UZ Gent, Gent, Oost-Vlaanderen, Belgium|AZ St-Jan Brugge-Oostende AV, Brugge, West-Vlaanderen, Belgium|ZNA Middelheim, Antwerp, Belgium|UZ Leuven, Leuven, Belgium|Hospital for Sick Children, Toronto, Ontario, Canada|Montreal Neurological Institut, Montreal, Quebec, Canada|Masarykuv onkologikcy ustav, Brno, Czechia|FN Hradec Kralove, Hradec Kralove, Czechia|Univ Hosp Ostrava-Poruba, Ostrava, Czechia|Fakultni Nemocnice v Motole, Prague, Czechia|Helsinki Univ Central Hospital, Helsinki, Finland|Helsinki Univ Central Hospital, Helsinki, Finland|Turku University Hospital, Turku, Finland|CHRU Lille - Hôpital Claude Huriez, Lille CEDEX, Hauts-de-France, France|Centre Oscar Lambret, Lille, Hauts-de-France, France|CHU-Hopital Avicenne, Bobigny, Ile-de-France, France|Institut Gustave Roussy, Villejuif, Ile-de-France, France|Institut de Cancer de l'Ouest, St Herblain CEDEX, Loire-Atlantique, France|Hopital de la Timone, Marseille CEDEX 05, Provence-Alpes-Cote-d Azur, France|CHU de Nice, Nice CEDEX 1, Provence-Alpes-Cote-d Azur, France|Centre Leon Berard, Lyon CEDEX 08, Rhone, France|Institut de Cancer de l'Ouest, Angers, France|Hospices Civils de Lyon, Bron, France|Hopital Pitie Salpetriere, Paris, France|Universitaetsklinik Heidelberg, Heidelberg, Baden-Wurttemberg, Germany|Universitatsklinik Regensburg, Ratisbon, Bayern, Germany|Univ Klinik Eppendorf Hamburg, Hamburg, Germany|Klinikum der Univ Munich, Munich, Germany|Universitatsklinikum Tubingen, Tuebingen, Germany|Pecsi Tudomanyegyetem, Pécs, Pecs, Hungary|Semmelweis Egyetem, Budapest, Hungary|National Institute of Oncology, Budapest, Hungary|Orszagos Klinikai Idegtudomany, Budapest, Hungary|Debreceni Egyetem Klinikai Koz, Debrecen, Hungary|Cork University Hospital, Cork, Ireland|Beaumont Hospital, Dublin, Ireland|Istituto delle Scienze Neurolo, Bologna, Italy|Ospedale Generale di Bolzano, Bolzano, Italy|Fondazione IRCCS Istituto Neur, Milan, Italy|Istituto Oncologico Veneto, Padua, Italy|Azienda Ospedaliera Sant' Andr, Rome, Italy|Seoul National Univ Bundang ho, Seongnam, Gyeonggido, Korea, Republic of|Seoul National University Hospital, Seoul, Seoul Teugbyeolsi, Korea, Republic of|Samsung Medical Center, Seoul, Seoul Teugbyeolsi, Korea, Republic of|Vrije Univ Medisch Centrum, Amsterdam, Netherlands|Univ Med Center Groningen, Groningen, Netherlands|Erasmus Medisch Centrum, Rotterdam, Netherlands|MC Haaglanden - Westeinde, The Hague, Netherlands|UMC Utrecht, Utrecht, Netherlands|Uniwersyteckie Centrum Kliniczne, Gdańsk, Mazowieckie, Poland|Wojewodzkie Wielospecjalistycz, Lodz, Poland|National University Hospital, Singapore, Singapore|National Cancer Ctr Singapore, Singapore, Singapore|KK Women's & Children Hospital, Singapore, Singapore|Hospital Duran i Reynals, L'Hospitalet de Llobregat, Barcelona, Spain|Clinica Universitar de Navarra, Pamplona, Navarra, Comunidad, Spain|Hospital Universitario Nino, Madrid, Spain|Hosp Univ 12 de Octubre, Madrid, Spain|Centre Hospitalier Univ Vaudoi, Lausanne, Switzerland|University Hospital Zurich, Zurich, Switzerland|China Medical University Hosp, Taichung City, Taichung, Taiwan|National Taiwan Univ Hosp, Taipei City, Taipei, Taiwan|Taichung Veterans General Hosp, Taichung City, Taiwan|Taipei Veterans General Hosp, Taipei City, Taiwan|Linkou Chang Gung Memorial Ho, Taoyuan City, Taiwan|Guy's and St Thomas' NHS Found, London, London, City Of, United Kingdom|Univ Hospitals Birmingham NHS Foundation trust, Birmingham, United Kingdom|Gartnavel General Hospital, Glasgow, United Kingdom|Hull and East Yorkshire NHS, Hull, United Kingdom|University College Hospitals, London, United Kingdom|Great Ormond St Hospital NHS, London, United Kingdom|Christie NHS Foundation Trust, Manchester, United Kingdom","","https://ClinicalTrials.gov/show/NCT02343406"
195,"NCT02747407","Qualitative, Qualitative, and Functional Studies Over the First Year in Measuring Immune System Response During the First Year of Therapy in Patients With Brain Tumors",,"Recruiting","No Results Available","Astrocytoma|Glioma|Oligodendroglioma","Biological: Hepatitis A Vaccine|Other: Laboratory Biomarker Analysis|Biological: Tetanus Toxoid Vaccine|Biological: Trivalent Influenza Vaccine","Proliferative ability of lymphocytes by carboxyfluorescein diacetate succinimidyl ester assay|The quantity of cells determined by flow cytometry|Response of the tetanus toxoid vaccine-specific IgG antibody|Vaccine-specific total antibody response after hepatitis A vaccination. In hepatitis A exposed patients, hepatitis B will be used.","Wake Forest University Health Sciences|National Cancer Institute (NCI)","All","18 Years and older   (Adult, Older Adult)","Phase 2","50","Other|NIH","Interventional","Allocation: Randomized|Intervention Model: Single Group Assignment|Masking: None (Open Label)|Primary Purpose: Basic Science","IRB00037250|NCI-2016-00472|CCCWFU 01316|P30CA012197","May 2016","August 2018","August 2018","April 21, 2016","null","July 2, 2018","Comprehensive Cancer Center of Wake Forest University, Winston-Salem, North Carolina, United States","","https://ClinicalTrials.gov/show/NCT02747407"
196,"NCT00075387","Combination Chemotherapy With or Without Sodium Thiosulfate in Preventing Low Platelet Count While Treating Patients With Malignant Brain Tumors",,"Recruiting","No Results Available","Glioma","Drug: Carboplatin|Drug: Cyclophosphamide|Drug: Etoposide Phosphate|Other: Quality-of-Life Assessment|Drug: Sodium Thiosulfate","Rate of platelet toxicities (i.e. platelet count less than 20,000), graded according to the National Cancer Institute Common Toxicity Criteria version 3.0|Change in hearing levels, if any, at the higher frequencies in the standard testing range (4000 and 8000 Hz), and at higher frequencies above standard testing (9000 to 16000 Hz) based on American Speech-Language-Hearing Association criteria|Erythrocyte counts|Granulocyte count|Number of dose reductions and transfusions due to platelet toxicity|Quality of life assessed by the European Organization for Research and Treatment of Cancer Quality of Life Questionnaire-C30 and Quality of Life Questionnaire-Brain Module-20|Time to disease progression|Time to response|Tumor response (complete response + partial response + stable disease) assessed by neurologic exams, radiographic studies, and steroid dose","OHSU Knight Cancer Institute|National Cancer Institute (NCI)","All","18 Years to 75 Years   (Adult, Older Adult)","Phase 2","60","Other|NIH","Interventional","Allocation: Randomized|Intervention Model: Parallel Assignment|Masking: Single (Investigator)|Primary Purpose: Treatment","IRB00000922|NCI-2013-00781|MR00041590|CR00023930|eIRB #922|CR00018679|ONC-02019-L|CR00021317|CR00022743|P30CA069533","March 7, 2003","April 30, 2020","April 30, 2021","January 12, 2004","null","May 7, 2018","University of Minnesota/Masonic Cancer Center, Minneapolis, Minnesota, United States|Cleveland Clinic Foundation, Cleveland, Ohio, United States|OHSU Knight Cancer Institute, Portland, Oregon, United States","","https://ClinicalTrials.gov/show/NCT00075387"
197,"NCT03496181","Evaluation of Functional Magnetic Resonance Imaging (fMRI) in Patients Who Speak Two Languages Fluently",,"Recruiting","No Results Available","Glioma|Glioma of Brain|Glioma of Spinal Cord","Behavioral: Multilingual Aphasia Examination|Diagnostic Test: Language paradigms + RS fMRI|Diagnostic Test: Language paradigms + RS fMRI + one anatomical sequence","Comparison of RS fMRI and overall TB fMRI","Memorial Sloan Kettering Cancer Center","All","18 Years and older   (Adult, Older Adult)","Not Applicable","60","Other","Interventional","Allocation: Non-Randomized|Intervention Model: Parallel Assignment|Masking: None (Open Label)|Primary Purpose: Diagnostic","18-121","March 30, 2018","March 2019","March 2019","April 12, 2018","null","June 12, 2018","Memorial Sloan - Kettering Cancer Center, New York, New York, United States|City College of New York, New York, New York, United States","","https://ClinicalTrials.gov/show/NCT03496181"
198,"NCT03050736","Safety Study of VAL-083 and Radiotherapy in Patients With Newly Diagnosed GBM Having Unmethylated MGMT Expression",,"Recruiting","No Results Available","Glioma|Glioblastoma|Glioblastoma Multiforme|GBM|Brain Cancer","Drug: VAL-083 (Dianhydrogalactitol)","Efficacy evaluation of tumor response in patients, as measured by magnetic resonance imaging|Safety evaluation of VAL-083 in combination with a standard radiation therapy, as determined by incidence of patient adverse events and changes in laboratory results, ECG and vital signs|Ctrough|Cmax|Tmax|AUClast|AUCinf|CL/F|Mean Residence Time|Vz|Lambda z|T½|Pharmacokinetic profile and dose-exposure relationship of VAL-083 in Cerebral Spinal Fluid (CSF)","DelMar Pharmaceuticals, Inc.|Sun Yat-sen University","All","18 Years to 69 Years   (Adult, Older Adult)","Phase 2","30","Industry|Other","Interventional","Intervention Model: Single Group Assignment|Masking: None (Open Label)|Primary Purpose: Treatment","DLM-14-001","February 2018","February 2019","August 2019","February 13, 2017","null","January 17, 2018","Sun Yat-Sen University Cancer Center, Guangzhou, China","","https://ClinicalTrials.gov/show/NCT03050736"
199,"NCT02717962","Study of VAL-083 in Patients With MGMT Unmethylated, Bevacizumab-naive Recurrent Glioblastoma",,"Recruiting","No Results Available","Glioma|Glioblastoma|Glioblastoma Multiforme|GBM|Brain Cancer","Drug: VAL-083, Dianhydrogalactitol","Overall Survival|Estimate Progression-free Survival|Estimate Median Progression-Free Survival|Estimate Median Overall Survival|Estimate Overall Response Rate|Estimate Duration of Response|Safety evaluation of VAL-083 in patients|Quality of Life|Plasma Pharmacokinetics","DelMar Pharmaceuticals, Inc.","All","18 Years and older   (Adult, Older Adult)","Phase 2","48","Industry","Interventional","Intervention Model: Single Group Assignment|Masking: None (Open Label)|Primary Purpose: Treatment","DLM-16-001","January 20, 2017","September 2020","June 2021","March 24, 2016","null","January 18, 2018","University of Texas MD Anderson Cancer Center, Houston, Texas, United States","","https://ClinicalTrials.gov/show/NCT02717962"
200,"NCT02756312","The Perioperative Anesthetic Management and the Prognosis of Patients Undergoing Brain Malignant Glioma Resection",,"Recruiting","No Results Available","Anesthesia, Prognosis, Malignant Glioma","Other: IV Anesthesia|Other: IH anesthesia","progression free survival rate","Beijing Tiantan Hospital","All","18 Years to 80 Years   (Adult, Older Adult)","Not Applicable","500","Other","Interventional","Allocation: Randomized|Intervention Model: Parallel Assignment|Masking: Triple (Participant, Investigator, Outcomes Assessor)|Primary Purpose: Treatment","ChiECRCT-2016008","July 15, 2017","October 31, 2018","December 31, 2018","April 29, 2016","null","July 17, 2017","Beijing Tiantan Hospital, Beijing, Beijing, China","","https://ClinicalTrials.gov/show/NCT02756312"
201,"NCT03466762","Resilience and Quality of Life Among Cancer Survivors",,"Not yet recruiting","No Results Available","Mental Health Wellness 1","Other: Non applicable","Resilience|Quality of life","Aga Khan University","All","18 Years and older   (Adult, Older Adult)","","500","Other","Observational","Observational Model: Other|Time Perspective: Cross-Sectional","5154-Sur-ERC-17","April 1, 2018","November 30, 2018","March 31, 2019","March 15, 2018","null","March 16, 2018","Aga Khan University, Karachi, Sindh, Pakistan","","https://ClinicalTrials.gov/show/NCT03466762"
202,"NCT02391246","Radionecrosis and FDG PET","DTPI FDG-PET","Recruiting","No Results Available","Malignant Glioma","Other: Positron Emission Tomography Imaging","sensitivity and specificity percentages|Cost efficiency analysis","Ottawa Hospital Research Institute","All","18 Years and older   (Adult, Older Adult)","","62","Other","Observational","Observational Model: Cohort|Time Perspective: Retrospective","20150094-01H","June 2015","March 2018","March 2018","March 18, 2015","null","April 13, 2017","The Ottawa Hospital, Ottawa, Ontario, Canada","","https://ClinicalTrials.gov/show/NCT02391246"
203,"NCT03565367","Hyperpolarized Carbon C 13 Pyruvate Magnetic Resonance Spectroscopic Imaging in Detecting Lactate and Bicarbonate in Participants With Central Nervous System Tumors",,"Not yet recruiting","No Results Available","Malignant Central Nervous System Neoplasm|Metastatic Malignant Neoplasm in the Central Nervous System","Other: Gadolinium|Drug: Hyperpolarized Carbon C 13 Pyruvate|Procedure: Magnetic Resonance Imaging|Procedure: Magnetic Resonance Spectroscopic Imaging","Incidence of Grade 2 or Higher Toxicities|Lactate and Bicarbonate Production in Tumor and Normal Brain Tissue","Daniel M. Spielman|Stanford University","All","18 Years and older   (Adult, Older Adult)","Phase 1","10","Other","Interventional","Intervention Model: Single Group Assignment|Masking: None (Open Label)|Primary Purpose: Diagnostic","BRN0036|NCI-2018-01122|39845","November 14, 2018","November 14, 2019","November 14, 2019","June 21, 2018","null","June 21, 2018","Stanford University School of Medicine, Palo Alto, California, United States","","https://ClinicalTrials.gov/show/NCT03565367"
204,"NCT01454596","CAR T Cell Receptor Immunotherapy Targeting EGFRvIII for Patients With Malignant Gliomas Expressing EGFRvIII",,"Recruiting","No Results Available","Malignant Glioma|Glioblastoma|Brain Cancer|Gliosarcoma","Biological: Anti-EGFRvIII CAR transduced PBL|Drug: Aldesleukin|Drug: Fludarabine|Drug: Cyclophosphamide","Frequency of treatment related adverse events|Progression-free survival|Radiographic changes|Engineered cell survival","National Cancer Institute (NCI)|National Institutes of Health Clinical Center (CC)","All","18 Years to 70 Years   (Adult, Older Adult)","Phase 1|Phase 2","107","NIH","Interventional","Allocation: Non-Randomized|Intervention Model: Sequential Assignment|Masking: None (Open Label)|Primary Purpose: Treatment","110266|11-C-0266","September 29, 2011","December 29, 2028","December 28, 2029","October 19, 2011","null","July 6, 2018","National Institutes of Health Clinical Center, 9000 Rockville Pike, Bethesda, Maryland, United States","","https://ClinicalTrials.gov/show/NCT01454596"
205,"NCT01904123","Trial of WP1066 in Patients With Recurrent Malignant Glioma and Brain Metastasis From Melanoma",,"Not yet recruiting","No Results Available","Brain Cancer|Central Nervous System Neoplasms|Melanoma|Solid Tumors","Drug: WP1066|Procedure: Advanced Brain Tumor Imaging (ABTI)|Procedure: Surgical Resection","Maximum Tolerated Dose (MTD) of WP1066|Overall Response Rate (ORR)|Progression Free Survival (PFS)","M.D. Anderson Cancer Center|National Institutes of Health (NIH)|National Cancer Institute (NCI)","All","18 Years and older   (Adult, Older Adult)","Phase 1","33","Other|NIH","Interventional","Allocation: Non-Randomized|Intervention Model: Parallel Assignment|Masking: None (Open Label)|Primary Purpose: Treatment","2012-0358|P50CA093459|P50CA127001|NCI-2015-00163","July 2018","July 2021","July 2022","July 22, 2013","null","May 4, 2018","University of Texas MD Anderson Cancer Center, Houston, Texas, United States","","https://ClinicalTrials.gov/show/NCT01904123"
206,"NCT02849743","Intranasal Oxytocin in Hypothalamic Obesity",,"Recruiting","No Results Available","Craniopharyngioma|Hypothalamic Obesity","Drug: Syntocinon|Drug: Placebo (for Syntocinon)","Weight loss|Number of participants with treatment-related adverse events as assessed by CTCAE v4.0|Peripheral oxytocin area under the curve (AUC)","Shana McCormack, MD|Children's Hospital of Philadelphia","All","10 Years to 35 Years   (Child, Adult)","Phase 2","30","Other","Interventional","Allocation: Randomized|Intervention Model: Crossover Assignment|Masking: Triple (Participant, Care Provider, Investigator)|Primary Purpose: Treatment","16-012730","October 2016","July 2019","July 2020","July 29, 2016","null","May 15, 2018","Children's Hospital of Philadelphia, Philadelphia, Pennsylvania, United States","","https://ClinicalTrials.gov/show/NCT02849743"
207,"NCT03543020","Radiation- Induced Alopecia in Patients Undergoing Radiation Therapy to the Brain",,"Recruiting","No Results Available","Alopecia; X-Rays","Radiation: radiation therapy to brain","To record the degree of alopecia at the conclusion of radiotherapy compared to pre- radiotherapy status with use of scalp sparing radiotherapy technique.|radiation dose range levels that causes alopecia|in vivo dosimetry values for scalp doses in modern radiotherapy treatment","Fortis Memorial Research Institute","All","Child, Adult, Older Adult","","50","Industry","Observational","Observational Model: Cohort|Time Perspective: Prospective","2017-008IP-20","July 17, 2017","December 17, 2018","January 30, 2019","June 1, 2018","null","June 14, 2018","Department of Radiation Oncology, Fortis Memorial Research Institute, Gurgaon, Haryana, India","","https://ClinicalTrials.gov/show/NCT03543020"
208,"NCT01817751","Sorafenib Tosylate, Valproic Acid, and Sildenafil Citrate in Treating Patients With Recurrent High-Grade Glioma",,"Recruiting","No Results Available","Glioblastoma|Recurrent Adult Brain Neoplasm|Malignant Glioma|WHO Grade III Glioma","Drug: sorafenib tosylate|Drug: valproic acid|Drug: sildenafil citrate","PFS|Overall best response rate (complete response + partial response) using RANO or Macdonald criteria.|Overall survival|Incidence of adverse events using the National Cancer Institute Common Terminology Criteria for Adverse Events, version 4.0","Virginia Commonwealth University|National Cancer Institute (NCI)","All","18 Years and older   (Adult, Older Adult)","Phase 2","66","Other|NIH","Interventional","Intervention Model: Single Group Assignment|Masking: None (Open Label)|Primary Purpose: Treatment","MCC-14816|HM14816|NCI-2013-00705|P30CA016059","April 11, 2013","December 31, 2018","March 31, 2019","March 25, 2013","null","March 21, 2018","Virginia Commonwealth University/Massey Cancer Center, Richmond, Virginia, United States","","https://ClinicalTrials.gov/show/NCT01817751"
